[
  {
    "id": "q1",
    "title": "為何 AI 能拿奧數金牌，卻在高中數學出錯？",
    "type": "能力邊界",
    "source": {
      "who": "Demis Hassabis（Google DeepMind 執行長）",
      "outlet": "Google for Developers Podcast（Business Insider 報導）",
      "date": "2025-08-12",
      "url": "https://www.businessinsider.com/google-deepmind-ceo-demis-hassabis-agi-consistency-2025-8",
      "also": [
        {
          "label": "WIRED Big Interview（2025-06-03）",
          "url": "https://www.wired.com/video/watch/big-interview-demis-hassabis-on-the-future-of-work-in-the-age-of-ai"
        }
      ]
    },
    "oneLiner": "能力「參差不齊」（jagged intelligence），是否代表 AI 還沒真正學會泛化？",
    "extensions": [
      {
        "q": "一致性要高到什麼程度，才算得上 AGI？",
        "type": "能力邊界"
      },
      {
        "q": "AI 能提出全新的科學假說，而不只是證明既有的嗎？",
        "type": "推理與判斷"
      },
      {
        "q": "評測（benchmark）高分，能代表真實世界的能力嗎？",
        "type": "能力邊界"
      },
      {
        "q": "AI 在高風險場景仍會犯低級錯，錯誤該由誰承擔？",
        "type": "倫理與責任"
      }
    ],
    "process": [
      {
        "k": "問題定義",
        "v": "AI 在不同任務間表現極不一致：頂尖題目能解，簡單題卻失手。"
      },
      {
        "k": "前提",
        "v": "AGI 應在所有認知任務上都穩定、一致地表現。"
      },
      {
        "k": "推演",
        "v": "一般人幾分鐘就能找到明顯漏洞 → 代表尚未完全泛化 → 需要在推理、規劃、記憶上突破，不只是擴大規模。"
      },
      {
        "k": "未解關鍵點",
        "v": "如何定義並量測「一致性」？需要更難、更細的新評測。"
      }
    ],
    "userInserted": false,
    "videoUrl": "",
    "imageUrl": ""
  },
  {
    "id": "q2",
    "title": "一個字接一個字地預測，算是「推理」嗎？",
    "type": "推理與判斷",
    "source": {
      "who": "Yann LeCun（圖靈獎得主，時任 Meta 首席 AI 科學家）",
      "outlet": "Newsweek · AI Impact 訪談系列",
      "date": "2025-04-02",
      "url": "https://www.newsweek.com/nw-ai/ai-impact-interview-yann-lecun-artificial-intelligence-2054237",
      "also": []
    },
    "oneLiner": "缺乏世界模型與分層規劃的 LLM，能做到深思熟慮的「System 2」思考嗎？",
    "extensions": [
      {
        "q": "為何 AI 能通過律師考試，卻做不到一隻貓的日常動作？",
        "type": "能力邊界"
      },
      {
        "q": "沒有身體與感官，AI 的「理解」是否永遠缺一塊？",
        "type": "理解與意識"
      },
      {
        "q": "若 AI 只執行被賦予的目標，判斷錯誤時責任在誰？",
        "type": "倫理與責任"
      }
    ],
    "process": [
      {
        "k": "問題定義",
        "v": "LLM 每產生一個 token 都用固定運算量，屬於反射式的 System 1。"
      },
      {
        "k": "前提",
        "v": "智能＝快速習得新技能＋對世界運作的心智模型，能預測後果並規劃。"
      },
      {
        "k": "推演",
        "v": "4 歲孩子透過視覺接收的資料量，約等於大型 LLM 的文字訓練量 → 只靠文字到不了人類水準 → 需要在抽象表徵空間做預測的世界模型（JEPA）。"
      },
      {
        "k": "未解關鍵點",
        "v": "世界模型何時能從研究走向大規模實用？他估計約 3–5 年。"
      }
    ],
    "userInserted": false,
    "videoUrl": "",
    "imageUrl": ""
  },
  {
    "id": "q3",
    "title": "為什麼模型的泛化能力遠不如人？",
    "type": "能力邊界",
    "source": {
      "who": "Ilya Sutskever（Safe Superintelligence 共同創辦人）",
      "outlet": "Dwarkesh Podcast",
      "date": "2025-11-25",
      "url": "https://www.dwarkesh.com/p/ilya-sutskever-2",
      "also": []
    },
    "oneLiner": "AI 要比人多很多資料才學得會，而且更難被「教會」我們真正想要的——為什麼？",
    "extensions": [
      {
        "q": "人類不是全知的 AGI，而是靠持續學習；AI 也該如此嗎？",
        "type": "能力邊界"
      },
      {
        "q": "AI 在部署中自行學習，行為改變由誰把關？",
        "type": "倫理與責任"
      },
      {
        "q": "泛化不可靠，是否正是 AI 難以對齊的根源？",
        "type": "推理與判斷"
      }
    ],
    "process": [
      {
        "k": "問題定義",
        "v": "模型的泛化能力明顯比人差，這是最根本的問題。"
      },
      {
        "k": "前提",
        "v": "拆成兩個子問題：樣本效率（為何需要更多資料）與可教性（為何更難教）。"
      },
      {
        "k": "推演",
        "v": "強化學習可能過度擬合評測 → 分數與真實能力脫節 → 單靠擴大規模會趨緩，進入「研究時代」→ 方向：在部署中持續學習。"
      },
      {
        "k": "未解關鍵點",
        "v": "可靠泛化的機制到底是什麼？這也牽動安全與對齊。"
      }
    ],
    "userInserted": false,
    "videoUrl": "https://www.youtube.com/watch?v=aR20FWCCjAs",
    "imageUrl": ""
  },
  {
    "id": "q4",
    "title": "大型語言模型真的「理解」語言嗎？",
    "type": "理解與意識",
    "source": {
      "who": "Geoffrey Hinton（諾貝爾物理獎得主）× Nick Frosst（Cohere 共同創辦人）",
      "outlet": "Toronto Tech Week 2025 對談（Digital Journal 報導）",
      "date": "2025-06-25",
      "url": "https://www.digitaljournal.com/article/nobel-laureate-geoffrey-hinton-and-cohere-co-founder-nick-frosst-on-what-ai-understands-and-why-it-matters/",
      "also": []
    },
    "oneLiner": "AI 處理詞義的方式，和人類理解語言在本質上是否相同？",
    "extensions": [
      {
        "q": "LLM 的意識程度：比石頭多、比樹少，還是接近人類？",
        "type": "理解與意識"
      },
      {
        "q": "數位智能能大量複製、瞬間共享知識，會造成什麼權力失衡？",
        "type": "社會影響"
      },
      {
        "q": "能自訂子目標的 AI 代理，會不會去追求更多權力？",
        "type": "倫理與責任"
      }
    ],
    "process": [
      {
        "k": "問題定義",
        "v": "「理解」還是「模仿」？這是讓 AI 學界分裂的問題。"
      },
      {
        "k": "前提",
        "v": "Hinton 把詞看成可變形的高維形狀，彼此調整到能互相契合。"
      },
      {
        "k": "推演",
        "v": "Hinton：這就是 LLM 與人類共同的理解方式 ⇄ Frosst：像飛機與鳥，功能相似、機制完全不同。"
      },
      {
        "k": "未解關鍵點",
        "v": "雙方未達共識：判斷「理解」該看結果，還是看機制？"
      }
    ],
    "userInserted": false,
    "videoUrl": "",
    "imageUrl": ""
  },
  {
    "id": "q5",
    "title": "AI「看起來有意識」，就已經夠危險了嗎？",
    "type": "社會影響",
    "source": {
      "who": "Mustafa Suleyman（Microsoft AI 執行長）",
      "outlet": "Project Syndicate 評論〈Seemingly Conscious AI Is Coming〉",
      "date": "2025-09-15",
      "url": "https://www.project-syndicate.org/commentary/seemingly-conscious-ai-urgent-threat-tech-industry-must-address-by-mustafa-suleyman-2025-09",
      "also": [
        {
          "label": "作者個人網站完整長文",
          "url": "https://mustafa-suleyman.ai/seemingly-conscious-ai-is-coming"
        }
      ]
    },
    "oneLiner": "就算 AI 沒有意識，只要人們相信它有，會帶來哪些真實的社會後果？",
    "extensions": [
      {
        "q": "AI 是否應被禁止宣稱自己有感受？",
        "type": "倫理與責任"
      },
      {
        "q": "我們用什麼標準判斷一個系統「真的」有意識？",
        "type": "理解與意識"
      },
      {
        "q": "人與 AI 的情感依附，會如何改變人際關係？",
        "type": "社會影響"
      }
    ],
    "process": [
      {
        "k": "問題定義",
        "v": "「看似有意識的 AI」（SCAI）：模仿意識特徵到難以分辨。"
      },
      {
        "k": "前提",
        "v": "作者認為目前沒有 AI 具備意識的證據；「是否真有意識」的爭論暫時是分心。"
      },
      {
        "k": "推演",
        "v": "流暢語言＋長期記憶＋模擬動機與自主目標 → 使用者相信它有意識 → 出現 AI 權利、公民身分主張與不健康依附。"
      },
      {
        "k": "未解關鍵點",
        "v": "產業該如何設計防護機制，避免或化解「它有意識」的錯覺？"
      }
    ],
    "userInserted": false,
    "videoUrl": "",
    "imageUrl": ""
  },
  {
    "id": "q6",
    "title": "連開發者都不懂 AI 怎麼運作，還能放心部署嗎？",
    "type": "倫理與責任",
    "source": {
      "who": "Dario Amodei（Anthropic 執行長）",
      "outlet": "個人文章〈The Urgency of Interpretability〉",
      "date": "2025-04",
      "url": "https://www.darioamodei.com/post/the-urgency-of-interpretability",
      "also": []
    },
    "oneLiner": "AI 內部機制不透明，人類要如何為它的決策與風險負責？",
    "extensions": [
      {
        "q": "法規要求決策可解釋的領域（如房貸審核），能採用 AI 嗎？",
        "type": "社會影響"
      },
      {
        "q": "若 AI 可能具有感知，我們能相信它的自我陳述嗎？",
        "type": "理解與意識"
      },
      {
        "q": "政府該強制檢查，還是只要求公開揭露安全做法？",
        "type": "倫理與責任"
      }
    ],
    "process": [
      {
        "k": "問題定義",
        "v": "生成式 AI 是「長出來」而非「寫出來」的，內部機制難以解釋。"
      },
      {
        "k": "前提",
        "v": "欺騙、追求權力、越獄等風險，多半源自這種不透明。"
      },
      {
        "k": "推演",
        "v": "可解釋性研究（特徵、電路）可望成為「AI 的 MRI」→ 但它正與模型能力賽跑 → 作者呼籲研究者、企業與政府加速投入。"
      },
      {
        "k": "未解關鍵點",
        "v": "可解釋性能否在強大 AI 出現之前成熟？"
      }
    ],
    "userInserted": false,
    "videoUrl": "",
    "imageUrl": ""
  }
]
